{
  "components": [
    {
      "id": "C-DEV",
      "name": "RL-100 Sensor",
      "kind": "device",
      "layer": 1,
      "parent": null,
      "trustZone": "device",
      "provenance": "own"
    },
    {
      "id": "C-MCU",
      "name": "Main MCU + firmware",
      "kind": "hardware",
      "layer": 2,
      "parent": "C-DEV",
      "trustZone": "device-core",
      "provenance": "own",
      "version": "STM32L5 / FW 2.4",
      "supplier": "STMicroelectronics",
      "license": "proprietary",
      "cpe": "cpe:2.3:h:st:stm32l5:-"
    },
    {
      "id": "C-RADAR",
      "name": "Radar front-end",
      "kind": "hardware",
      "layer": 2,
      "parent": "C-DEV",
      "trustZone": "device-core",
      "provenance": "own"
    },
    {
      "id": "C-BT",
      "name": "Bluetooth commissioning stack",
      "kind": "software",
      "layer": 2,
      "parent": "C-DEV",
      "trustZone": "device-edge",
      "provenance": "third-party (OSS)",
      "version": "5.66",
      "supplier": "BlueZ",
      "license": "GPL-2.0-or-later",
      "cpe": "pkg:generic/bluez@5.66"
    },
    {
      "id": "C-HART",
      "name": "HART/4-20 mA modem",
      "kind": "software",
      "layer": 2,
      "parent": "C-DEV",
      "trustZone": "device-edge",
      "provenance": "own"
    },
    {
      "id": "C-BOOT",
      "name": "Signed bootloader",
      "kind": "software",
      "layer": 2,
      "parent": "C-DEV",
      "trustZone": "device-core",
      "provenance": "own"
    },
    {
      "id": "C-CFG",
      "name": "Config + credential store",
      "kind": "store",
      "layer": 2,
      "parent": "C-DEV",
      "trustZone": "device-core",
      "provenance": "own"
    },
    {
      "id": "C-DCS",
      "name": "Plant DCS",
      "kind": "external-entity",
      "layer": 1,
      "parent": null,
      "trustZone": "external"
    },
    {
      "id": "C-PHONE",
      "name": "Maintenance phone/app",
      "kind": "external-entity",
      "layer": 1,
      "parent": null,
      "trustZone": "external"
    }
  ],
  "interfaces": [
    {
      "id": "I-HART",
      "name": "4-20 mA + HART",
      "component": "C-HART",
      "exposure": "local",
      "protocol": "HART",
      "category": "network"
    },
    {
      "id": "I-BT",
      "name": "Bluetooth LE",
      "component": "C-BT",
      "exposure": "adjacent",
      "protocol": "BLE",
      "category": "user"
    },
    {
      "id": "I-JTAG",
      "name": "JTAG/SWD debug",
      "component": "C-MCU",
      "exposure": "physical",
      "protocol": "SWD",
      "category": "external"
    }
  ],
  "trustBoundaries": [
    {
      "id": "TB-ENC",
      "name": "Sensor enclosure",
      "members": [
        "C-MCU",
        "C-RADAR",
        "C-BT",
        "C-HART",
        "C-BOOT",
        "C-CFG"
      ]
    },
    {
      "id": "TB-WIRE",
      "name": "Field wiring to DCS",
      "members": [
        "C-HART",
        "C-DCS"
      ]
    }
  ],
  "assets": [
    {
      "id": "AS-MEAS",
      "name": "Level measurement integrity",
      "type": "physical-process",
      "storage": "Transient — volatile RAM and the live 4-20 mA/HART output frame",
      "components": [
        "C-RADAR",
        "C-MCU",
        "C-HART"
      ],
      "objectives": {
        "confidentiality": 1,
        "integrity": 5,
        "availability": 4,
        "safety": 5
      }
    },
    {
      "id": "AS-FW",
      "name": "Firmware integrity",
      "type": "firmware",
      "storage": "Internal MCU flash (application + signed bootloader)",
      "components": [
        "C-MCU",
        "C-BOOT"
      ],
      "objectives": {
        "confidentiality": 2,
        "integrity": 5,
        "availability": 3,
        "safety": 4
      }
    },
    {
      "id": "AS-CRED",
      "name": "Commissioning credentials",
      "type": "credential",
      "storage": "Encrypted region of the config store (C-CFG) in internal flash",
      "components": [
        "C-CFG",
        "C-BT"
      ],
      "objectives": {
        "confidentiality": 4,
        "integrity": 4,
        "availability": 2,
        "safety": 2
      }
    }
  ]
}
